{
  "schema_version": "vibescreen.evidence/v1",
  "run_id": "2026-08-30-nubia-p0110-latency-camera-current-base-blocked",
  "gate_profiles": [
    {
      "profile": "usb-glass-to-glass-sub50",
      "checks": {
        "device_identity_recorded": true,
        "host_build_identity_recorded": false,
        "external_camera_timebase_ready": false,
        "raw_camera_recording_retained": false,
        "sample_annotations_retained": false,
        "minimum_sample_count_ready": false,
        "formal_manifest_retained": false,
        "usb_transport_ready": false
      }
    },
    {
      "profile": "lan-glass-to-glass-sub80",
      "checks": {
        "device_identity_recorded": true,
        "host_build_identity_recorded": false,
        "external_camera_timebase_ready": false,
        "raw_camera_recording_retained": false,
        "sample_annotations_retained": false,
        "minimum_sample_count_ready": false,
        "formal_manifest_retained": false,
        "lan_transport_ready": false
      }
    },
    {
      "profile": "input-p95-sub50",
      "checks": {
        "device_identity_recorded": true,
        "host_build_identity_recorded": false,
        "measurement_timebase_ready": false,
        "sample_annotations_retained": false,
        "minimum_sample_count_ready": false,
        "formal_manifest_retained": false,
        "physical_input_actuation_ready": false,
        "visible_mac_input_result_ready": false
      }
    }
  ],
  "notes": [
    "No external-camera or optical single-timebase package is retained for USB or LAN glass-to-glass latency.",
    "No raw high-frame-rate camera recording or annotated latency samples are retained for the README latency profiles.",
    "No synchronized-clock input package with a reviewable sub-5 ms total error budget is retained for input latency.",
    "Unsynchronized host/client telemetry, decoder timings, RTT, screenshots, and ADB-generated input remain diagnostics only and cannot close these gates."
  ]
}
